ubuntu@ubuntu:~$ bash test_cpuid.sh 0x4fffffff
EXIT 0
CPU 0:
   0x4fffffff 0x00: eax=0x4fffffff ebx=0x00000000 ecx=0x00185798 edx=0xffff8d5a
EXIT 1
CPU 0:
   0x4fffffff 0x01: eax=0x4fffffff ebx=0x00000000 ecx=0x001c52b6 edx=0xffff8d5a
EXIT 2
CPU 0:
   0x4fffffff 0x02: eax=0x4fffffff ebx=0x00000000 ecx=0x00000000 edx=0xffff8d5a
EXIT 3
CPU 0:
   0x4fffffff 0x03: eax=0x4fffffff ebx=0x00000000 ecx=0x00000000 edx=0xffff8d5a
EXIT 4
CPU 0:
   0x4fffffff 0x04: eax=0x4fffffff ebx=0x00000000 ecx=0x00000000 edx=0xffff8d5a
EXIT 5
CPU 0:
   0x4fffffff 0x05: eax=0x00000000 ebx=0x00000000 ecx=0x00000000 edx=0xffffffff
EXIT 6
CPU 0:
   0x4fffffff 0x06: eax=0x00000000 ebx=0x00000000 ecx=0x00000000 edx=0xffffffff
EXIT 7
CPU 0:
   0x4fffffff 0x07: eax=0x4fffffff ebx=0x00000000 ecx=0x0021f940 edx=0xffff8d5a
EXIT 8
CPU 0:
   0x4fffffff 0x08: eax=0x4fffffff ebx=0x00000000 ecx=0x00000000 edx=0xffff8d5a
EXIT 9
CPU 0:
   0x4fffffff 0x09: eax=0x4fffffff ebx=0x00000000 ecx=0x00000000 edx=0xffff8d5a
EXIT 10
CPU 0:
   0x4fffffff 0x0a: eax=0x4fffffff ebx=0x00000000 ecx=0x026ceee0 edx=0xffff8d5a
EXIT 11
CPU 0:
   0x4fffffff 0x0b: eax=0x00000000 ebx=0x00000000 ecx=0x00000000 edx=0xffffffff
EXIT 12
CPU 0:
   0x4fffffff 0x0c: eax=0x4fffffff ebx=0x00000000 ecx=0x002dd296 edx=0xffff8d5a
EXIT 13
CPU 0:
   0x4fffffff 0x0d: eax=0x4fffffff ebx=0x00000000 ecx=0x00000000 edx=0xffff8d5a
EXIT 14
CPU 0:
   0x4fffffff 0x0e: eax=0x4fffffff ebx=0x00000000 ecx=0x00000000 edx=0xffff8d5a
EXIT 15
CPU 0:
   0x4fffffff 0x0f: eax=0x4fffffff ebx=0x00000000 ecx=0x00000000 edx=0xffff8d5a
EXIT 16
CPU 0:
   0x4fffffff 0x10: eax=0x4fffffff ebx=0x00000000 ecx=0x00000000 edx=0xffff8d5a
EXIT 17
CPU 0:
   0x4fffffff 0x11: eax=0x00000000 ebx=0x00000000 ecx=0x00000000 edx=0xffffffff
EXIT 18
CPU 0:
   0x4fffffff 0x12: eax=0x4fffffff ebx=0x00000000 ecx=0x00000000 edx=0xffff8d5a
EXIT 19
CPU 0:
   0x4fffffff 0x13: eax=0x4fffffff ebx=0x00000000 ecx=0x00000000 edx=0xffff8d5a
EXIT 20
CPU 0:
   0x4fffffff 0x14: eax=0x4fffffff ebx=0x00000000 ecx=0x00000000 edx=0xffff8d5a
EXIT 21
CPU 0:
   0x4fffffff 0x15: eax=0x4fffffff ebx=0x00000000 ecx=0x00000000 edx=0xffff8d5a
EXIT 22
CPU 0:
   0x4fffffff 0x16: eax=0x4fffffff ebx=0x00000000 ecx=0x00000000 edx=0xffff8d5a
EXIT 23
CPU 0:
   0x4fffffff 0x17: eax=0x4fffffff ebx=0x00000000 ecx=0x00000000 edx=0xffff8d5a
EXIT 24
CPU 0:
   0x4fffffff 0x18: eax=0x4fffffff ebx=0x00000000 ecx=0x00000000 edx=0xffff8d5a
EXIT 25
CPU 0:
   0x4fffffff 0x19: eax=0x4fffffff ebx=0x00000000 ecx=0x00000000 edx=0xffff8d5a
EXIT 26
CPU 0:
   0x4fffffff 0x1a: eax=0x4fffffff ebx=0x00000000 ecx=0x00000000 edx=0xffff8d5a
EXIT 27
CPU 0:
   0x4fffffff 0x1b: eax=0x4fffffff ebx=0x00000000 ecx=0x00000000 edx=0xffff8d5a
EXIT 28
CPU 0:
   0x4fffffff 0x1c: eax=0x4fffffff ebx=0x00000000 ecx=0x0602e246 edx=0xffff8d5a
EXIT 29
CPU 0:
   0x4fffffff 0x1d: eax=0x4fffffff ebx=0x00000000 ecx=0x000042ae edx=0xffff8d5a
EXIT 30
CPU 0:
   0x4fffffff 0x1e: eax=0x4fffffff ebx=0x00000000 ecx=0xa9de5036 edx=0xffff8d5a
EXIT 31
CPU 0:
   0x4fffffff 0x1f: eax=0x4fffffff ebx=0x00000000 ecx=0x0007d184 edx=0xffff8d5a
EXIT 32
CPU 0:
   0x4fffffff 0x20: eax=0x4fffffff ebx=0x00000000 ecx=0x04e49fb2 edx=0xffff8d5a
EXIT 33
CPU 0:
   0x4fffffff 0x21: eax=0x4fffffff ebx=0x00000000 ecx=0x00000000 edx=0xffff8d5a
EXIT 34
CPU 0:
   0x4fffffff 0x22: eax=0x4fffffff ebx=0x00000000 ecx=0x00000000 edx=0xffff8d5a
EXIT 35
CPU 0:
   0x4fffffff 0x23: eax=0x00000000 ebx=0x00000000 ecx=0x00000000 edx=0xffffffff
EXIT 36
CPU 0:
   0x4fffffff 0x24: eax=0x4fffffff ebx=0x00000000 ecx=0x00000000 edx=0xffff8d5a
EXIT 37
CPU 0:
   0x4fffffff 0x25: eax=0x4fffffff ebx=0x00000000 ecx=0x00000000 edx=0xffff8d5a
EXIT 38
CPU 0:
   0x4fffffff 0x26: eax=0x00000000 ebx=0x00000000 ecx=0x00000000 edx=0xffffffff
EXIT 39
CPU 0:
   0x4fffffff 0x27: eax=0x4fffffff ebx=0x00000000 ecx=0x00000000 edx=0xffff8d5a
EXIT 40
CPU 0:
   0x4fffffff 0x28: eax=0x4fffffff ebx=0x00000000 ecx=0x00000000 edx=0xffff8d5a
EXIT 41
CPU 0:
   0x4fffffff 0x29: eax=0x4fffffff ebx=0x00000000 ecx=0x00000000 edx=0xffff8d5a
EXIT 42
CPU 0:
   0x4fffffff 0x2a: eax=0x00000000 ebx=0x00000000 ecx=0x00000000 edx=0xffffffff
EXIT 43
CPU 0:
   0x4fffffff 0x2b: eax=0x4fffffff ebx=0x00000000 ecx=0x00000000 edx=0xffff8d5a
EXIT 44
CPU 0:
   0x4fffffff 0x2c: eax=0x4fffffff ebx=0x00000000 ecx=0x00000000 edx=0xffff8d5a
EXIT 45
CPU 0:
   0x4fffffff 0x2d: eax=0x4fffffff ebx=0x00000000 ecx=0x00000000 edx=0xffff8d5a
EXIT 46
CPU 0:
   0x4fffffff 0x2e: eax=0x4fffffff ebx=0x00000000 ecx=0x00000000 edx=0xffff8d5a
EXIT 47
CPU 0:
   0x4fffffff 0x2f: eax=0x4fffffff ebx=0x00000000 ecx=0x00000000 edx=0xffff8d5a
EXIT 48
CPU 0:
   0x4fffffff 0x30: eax=0x4fffffff ebx=0x00000000 ecx=0x16451972 edx=0xffff8d5a
EXIT 49
CPU 0:
   0x4fffffff 0x31: eax=0x4fffffff ebx=0x00000000 ecx=0x7d79f26a edx=0xffff8d5a
EXIT 50
CPU 0:
   0x4fffffff 0x32: eax=0x4fffffff ebx=0x00000000 ecx=0x00000000 edx=0xffff8d5a
EXIT 51
CPU 0:
   0x4fffffff 0x33: eax=0x4fffffff ebx=0x00000000 ecx=0x00000000 edx=0xffff8d5a
EXIT 52
CPU 0:
   0x4fffffff 0x34: eax=0x4fffffff ebx=0x00000000 ecx=0x00000000 edx=0xffff8d5a
EXIT 53
CPU 0:
   0x4fffffff 0x35: eax=0x4fffffff ebx=0x00000000 ecx=0x00000000 edx=0xffff8d5a
EXIT 54
CPU 0:
   0x4fffffff 0x36: eax=0x4fffffff ebx=0x00000000 ecx=0x0000143a edx=0xffff8d5a
EXIT 55
CPU 0:
   0x4fffffff 0x37: eax=0x4fffffff ebx=0x00000000 ecx=0x00000000 edx=0xffff8d5a
EXIT 56
CPU 0:
   0x4fffffff 0x38: eax=0x4fffffff ebx=0x00000000 ecx=0x00000000 edx=0xffff8d5a
EXIT 57
CPU 0:
   0x4fffffff 0x39: eax=0x4fffffff ebx=0x00000000 ecx=0x00000000 edx=0xffff8d5a
EXIT 58
CPU 0:
   0x4fffffff 0x3a: eax=0x4fffffff ebx=0x00000000 ecx=0x00000000 edx=0xffff8d5a
EXIT 59
CPU 0:
   0x4fffffff 0x3b: eax=0x4fffffff ebx=0x00000000 ecx=0x00000000 edx=0xffff8d5a
EXIT 60
CPU 0:
   0x4fffffff 0x3c: eax=0x4fffffff ebx=0x00000000 ecx=0x00000000 edx=0xffff8d5a
EXIT 61
CPU 0:
   0x4fffffff 0x3d: eax=0x4fffffff ebx=0x00000000 ecx=0x00000000 edx=0xffff8d5a
EXIT 62
CPU 0:
   0x4fffffff 0x3e: eax=0x4fffffff ebx=0x00000000 ecx=0x00000000 edx=0xffff8d5a
EXIT 63
CPU 0:
   0x4fffffff 0x3f: eax=0x4fffffff ebx=0x00000000 ecx=0x00000000 edx=0xffff8d5a
EXIT 64
CPU 0:
   0x4fffffff 0x40: eax=0x4fffffff ebx=0x00000000 ecx=0x00000000 edx=0xffff8d5a
EXIT 65
CPU 0:
   0x4fffffff 0x41: eax=0x00000000 ebx=0x00000000 ecx=0x00000000 edx=0xffffffff
EXIT 66
CPU 0:
   0x4fffffff 0x42: eax=0x00000000 ebx=0x00000000 ecx=0x00000000 edx=0xffffffff
EXIT 67
CPU 0:
   0x4fffffff 0x43: eax=0x4fffffff ebx=0x00000000 ecx=0x00000000 edx=0xffff8d5a
EXIT 68
CPU 0:
   0x4fffffff 0x44: eax=0x4fffffff ebx=0x00000000 ecx=0x00000000 edx=0xffff8d5a
EXIT 69
CPU 0:
   0x4fffffff 0x45: eax=0x00000000 ebx=0x00000000 ecx=0x00000000 edx=0xffffffff
EXIT 70
CPU 0:
   0x4fffffff 0x46: eax=0x00000000 ebx=0x00000000 ecx=0x00000000 edx=0xffffffff
EXIT 71
CPU 0:
   0x4fffffff 0x47: eax=0x00000000 ebx=0x00000000 ecx=0x00000000 edx=0xffffffff
EXIT 72
CPU 0:
   0x4fffffff 0x48: eax=0x00000000 ebx=0x00000000 ecx=0x00000000 edx=0xffffffff
EXIT 73
CPU 0:
   0x4fffffff 0x49: eax=0x00000000 ebx=0x00000000 ecx=0x00000000 edx=0xffffffff
EXIT 74
CPU 0:
   0x4fffffff 0x4a: eax=0x00000000 ebx=0x00000000 ecx=0x00000000 edx=0x00000000
EXIT 75
CPU 0:
   0x4fffffff 0x4b: eax=0x00000000 ebx=0x00000000 ecx=0x00000000 edx=0xffffffff
EXIT 76
CPU 0:
   0x4fffffff 0x4c: eax=0x00000000 ebx=0x00000000 ecx=0x00000000 edx=0xffffffff