ubuntu@ubuntu:~$ bash test_cpuid.sh 0x4ffffffe
EXIT 0
CPU 0:
   0x4ffffffe 0x00: eax=0x0000000b ebx=0x00000000 ecx=0x00000000 edx=0xffff8d5a
EXIT 1
CPU 0:
   0x4ffffffe 0x01: eax=0x00002843 ebx=0x00000000 ecx=0x00000001 edx=0xffff8d5a
EXIT 2
CPU 0:
   0x4ffffffe 0x02: eax=0x00000000 ebx=0x00000000 ecx=0x00000002 edx=0xffff8d5a
EXIT 3
CPU 0:
   0x4ffffffe 0x03: eax=0x00000000 ebx=0x00000000 ecx=0x00000003 edx=0xffff8d5a
EXIT 4
CPU 0:
   0x4ffffffe 0x04: eax=0x00000000 ebx=0x00000000 ecx=0x00000004 edx=0xffff8d5a
EXIT 5
CPU 0:
   0x4ffffffe 0x05: eax=0x00000000 ebx=0x00000000 ecx=0x00000000 edx=0xffffffff
EXIT 6
CPU 0:
   0x4ffffffe 0x06: eax=0x00000000 ebx=0x00000000 ecx=0x00000000 edx=0xffffffff
EXIT 7
CPU 0:
   0x4ffffffe 0x07: eax=0x00001d1c ebx=0x00000000 ecx=0x00000007 edx=0xffff8d5a
EXIT 8
CPU 0:
   0x4ffffffe 0x08: eax=0x00000000 ebx=0x00000000 ecx=0x00000008 edx=0xffff8d5a
EXIT 9
CPU 0:
   0x4ffffffe 0x09: eax=0x00000000 ebx=0x00000000 ecx=0x00000009 edx=0xffff8d5a
EXIT 10
CPU 0:
   0x4ffffffe 0x0a: eax=0x0000a654 ebx=0x00000000 ecx=0x0000000a edx=0xffff8d5a
EXIT 11
CPU 0:
   0x4ffffffe 0x0b: eax=0x00000000 ebx=0x00000000 ecx=0x00000000 edx=0xffffffff
EXIT 12
CPU 0:
   0x4ffffffe 0x0c: eax=0x00000f2f ebx=0x00000000 ecx=0x0000000c edx=0xffff8d5a
EXIT 13
CPU 0:
   0x4ffffffe 0x0d: eax=0x00000000 ebx=0x00000000 ecx=0x0000000d edx=0xffff8d5a
EXIT 14
CPU 0:
   0x4ffffffe 0x0e: eax=0x00000000 ebx=0x00000000 ecx=0x0000000e edx=0xffff8d5a
EXIT 15
CPU 0:
   0x4ffffffe 0x0f: eax=0x00000000 ebx=0x00000000 ecx=0x0000000f edx=0xffff8d5a
EXIT 16
CPU 0:
   0x4ffffffe 0x10: eax=0x00000000 ebx=0x00000000 ecx=0x00000010 edx=0xffff8d5a
EXIT 17
CPU 0:
   0x4ffffffe 0x11: eax=0x00000000 ebx=0x00000000 ecx=0x00000000 edx=0xffffffff
EXIT 18
CPU 0:
   0x4ffffffe 0x12: eax=0x00000000 ebx=0x00000000 ecx=0x00000012 edx=0xffff8d5a
EXIT 19
CPU 0:
   0x4ffffffe 0x13: eax=0x00000000 ebx=0x00000000 ecx=0x00000013 edx=0xffff8d5a
EXIT 20
CPU 0:
   0x4ffffffe 0x14: eax=0x00000000 ebx=0x00000000 ecx=0x00000014 edx=0xffff8d5a
EXIT 21
CPU 0:
   0x4ffffffe 0x15: eax=0x00000000 ebx=0x00000000 ecx=0x00000015 edx=0xffff8d5a
EXIT 22
CPU 0:
   0x4ffffffe 0x16: eax=0x00000000 ebx=0x00000000 ecx=0x00000016 edx=0xffff8d5a
EXIT 23
CPU 0:
   0x4ffffffe 0x17: eax=0x00000000 ebx=0x00000000 ecx=0x00000017 edx=0xffff8d5a
EXIT 24
CPU 0:
   0x4ffffffe 0x18: eax=0x00000000 ebx=0x00000000 ecx=0x00000018 edx=0xffff8d5a
EXIT 25
CPU 0:
   0x4ffffffe 0x19: eax=0x00000000 ebx=0x00000000 ecx=0x00000019 edx=0xffff8d5a
EXIT 26
CPU 0:
   0x4ffffffe 0x1a: eax=0x00000000 ebx=0x00000000 ecx=0x0000001a edx=0xffff8d5a
EXIT 27
CPU 0:
   0x4ffffffe 0x1b: eax=0x00000000 ebx=0x00000000 ecx=0x0000001b edx=0xffff8d5a
EXIT 28
CPU 0:
   0x4ffffffe 0x1c: eax=0x000138e5 ebx=0x00000000 ecx=0x0000001c edx=0xffff8d5a
EXIT 29
CPU 0:
   0x4ffffffe 0x1d: eax=0x00000002 ebx=0x00000000 ecx=0x0000001d edx=0xffff8d5a
EXIT 30
CPU 0:
   0x4ffffffe 0x1e: eax=0x000e4bc3 ebx=0x00000000 ecx=0x0000001e edx=0xffff8d5a
EXIT 31
CPU 0:
   0x4ffffffe 0x1f: eax=0x000000dd ebx=0x00000000 ecx=0x0000001f edx=0xffff8d5a
EXIT 32
CPU 0:
   0x4ffffffe 0x20: eax=0x00002b05 ebx=0x00000000 ecx=0x00000020 edx=0xffff8d5a
EXIT 33
CPU 0:
   0x4ffffffe 0x21: eax=0x00000000 ebx=0x00000000 ecx=0x00000021 edx=0xffff8d5a
EXIT 34
CPU 0:
   0x4ffffffe 0x22: eax=0x00000000 ebx=0x00000000 ecx=0x00000022 edx=0xffff8d5a
EXIT 35
CPU 0:
   0x4ffffffe 0x23: eax=0x00000000 ebx=0x00000000 ecx=0x00000000 edx=0xffffffff
EXIT 36
CPU 0:
   0x4ffffffe 0x24: eax=0x00000000 ebx=0x00000000 ecx=0x00000024 edx=0xffff8d5a
EXIT 37
CPU 0:
   0x4ffffffe 0x25: eax=0x00000000 ebx=0x00000000 ecx=0x00000025 edx=0xffff8d5a
EXIT 38
CPU 0:
   0x4ffffffe 0x26: eax=0x00000000 ebx=0x00000000 ecx=0x00000000 edx=0xffffffff
EXIT 39
CPU 0:
   0x4ffffffe 0x27: eax=0x00000000 ebx=0x00000000 ecx=0x00000027 edx=0xffff8d5a
EXIT 40
CPU 0:
   0x4ffffffe 0x28: eax=0x00000000 ebx=0x00000000 ecx=0x00000028 edx=0xffff8d5a
EXIT 41
CPU 0:
   0x4ffffffe 0x29: eax=0x00000000 ebx=0x00000000 ecx=0x00000029 edx=0xffff8d5a
EXIT 42
CPU 0:
   0x4ffffffe 0x2a: eax=0x00000000 ebx=0x00000000 ecx=0x00000000 edx=0xffffffff
EXIT 43
CPU 0:
   0x4ffffffe 0x2b: eax=0x00000000 ebx=0x00000000 ecx=0x0000002b edx=0xffff8d5a
EXIT 44
CPU 0:
   0x4ffffffe 0x2c: eax=0x00000000 ebx=0x00000000 ecx=0x0000002c edx=0xffff8d5a
EXIT 45
CPU 0:
   0x4ffffffe 0x2d: eax=0x00000000 ebx=0x00000000 ecx=0x0000002d edx=0xffff8d5a
EXIT 46
CPU 0:
   0x4ffffffe 0x2e: eax=0x00000000 ebx=0x00000000 ecx=0x0000002e edx=0xffff8d5a
EXIT 47
CPU 0:
   0x4ffffffe 0x2f: eax=0x00000000 ebx=0x00000000 ecx=0x0000002f edx=0xffff8d5a
EXIT 48
CPU 0:
   0x4ffffffe 0x30: eax=0x000029f1 ebx=0x00000000 ecx=0x00000030 edx=0xffff8d5a
EXIT 49
CPU 0:
   0x4ffffffe 0x31: eax=0x000296b8 ebx=0x00000000 ecx=0x00000031 edx=0xffff8d5a
EXIT 50
CPU 0:
   0x4ffffffe 0x32: eax=0x00000000 ebx=0x00000000 ecx=0x00000032 edx=0xffff8d5a
EXIT 51
CPU 0:
   0x4ffffffe 0x33: eax=0x00000000 ebx=0x00000000 ecx=0x00000033 edx=0xffff8d5a
EXIT 52
CPU 0:
   0x4ffffffe 0x34: eax=0x00000000 ebx=0x00000000 ecx=0x00000034 edx=0xffff8d5a
EXIT 53
CPU 0:
   0x4ffffffe 0x35: eax=0x00000000 ebx=0x00000000 ecx=0x00000035 edx=0xffff8d5a
EXIT 54
CPU 0:
   0x4ffffffe 0x36: eax=0x00000006 ebx=0x00000000 ecx=0x00000036 edx=0xffff8d5a
EXIT 55
CPU 0:
   0x4ffffffe 0x37: eax=0x00000000 ebx=0x00000000 ecx=0x00000037 edx=0xffff8d5a
EXIT 56
CPU 0:
   0x4ffffffe 0x38: eax=0x00000000 ebx=0x00000000 ecx=0x00000038 edx=0xffff8d5a
EXIT 57
CPU 0:
   0x4ffffffe 0x39: eax=0x00000000 ebx=0x00000000 ecx=0x00000039 edx=0xffff8d5a
EXIT 58
CPU 0:
   0x4ffffffe 0x3a: eax=0x00000000 ebx=0x00000000 ecx=0x0000003a edx=0xffff8d5a
EXIT 59
CPU 0:
   0x4ffffffe 0x3b: eax=0x00000000 ebx=0x00000000 ecx=0x0000003b edx=0xffff8d5a
EXIT 60
CPU 0:
   0x4ffffffe 0x3c: eax=0x00000000 ebx=0x00000000 ecx=0x0000003c edx=0xffff8d5a
EXIT 61
CPU 0:
   0x4ffffffe 0x3d: eax=0x00000000 ebx=0x00000000 ecx=0x0000003d edx=0xffff8d5a
EXIT 62
CPU 0:
   0x4ffffffe 0x3e: eax=0x00000000 ebx=0x00000000 ecx=0x0000003e edx=0xffff8d5a
EXIT 63
CPU 0:
   0x4ffffffe 0x3f: eax=0x00000000 ebx=0x00000000 ecx=0x0000003f edx=0xffff8d5a
EXIT 64
CPU 0:
   0x4ffffffe 0x40: eax=0x00000000 ebx=0x00000000 ecx=0x00000040 edx=0xffff8d5a
EXIT 65
CPU 0:
   0x4ffffffe 0x41: eax=0x00000000 ebx=0x00000000 ecx=0x00000000 edx=0xffffffff
EXIT 66
CPU 0:
   0x4ffffffe 0x42: eax=0x00000000 ebx=0x00000000 ecx=0x00000000 edx=0xffffffff
EXIT 67
CPU 0:
   0x4ffffffe 0x43: eax=0x00000000 ebx=0x00000000 ecx=0x00000043 edx=0xffff8d5a
EXIT 68
CPU 0:
   0x4ffffffe 0x44: eax=0x00000000 ebx=0x00000000 ecx=0x00000044 edx=0xffff8d5a
EXIT 69
CPU 0:
   0x4ffffffe 0x45: eax=0x00000000 ebx=0x00000000 ecx=0x00000000 edx=0xffffffff
EXIT 70
CPU 0:
   0x4ffffffe 0x46: eax=0x00000000 ebx=0x00000000 ecx=0x00000000 edx=0xffffffff
EXIT 71
CPU 0:
   0x4ffffffe 0x47: eax=0x00000000 ebx=0x00000000 ecx=0x00000000 edx=0xffffffff
EXIT 72
CPU 0:
   0x4ffffffe 0x48: eax=0x00000000 ebx=0x00000000 ecx=0x00000000 edx=0xffffffff
EXIT 73
CPU 0:
   0x4ffffffe 0x49: eax=0x00000000 ebx=0x00000000 ecx=0x00000000 edx=0xffffffff
EXIT 74
CPU 0:
   0x4ffffffe 0x4a: eax=0x00000000 ebx=0x00000000 ecx=0x00000000 edx=0x00000000
EXIT 75
CPU 0:
   0x4ffffffe 0x4b: eax=0x00000000 ebx=0x00000000 ecx=0x00000000 edx=0xffffffff
EXIT 76
CPU 0:
   0x4ffffffe 0x4c: eax=0x00000000 ebx=0x00000000 ecx=0x00000000 edx=0xffffffff
